adult,backdrop_path,genre_ids,id,original_language,original_title,overview,popularity,poster_path,release_date,title,video,vote_average,vote_count
False,/3V4kLQg0kSqPLctI5ziYWabAZYF.jpg,"[878, 28, 12]",912649,en,Venom: The Last Dance,"Eddie and Venom are on the run. Hunted by both of their worlds and with the net closing in, the duo are forced into a devastating decision that will bring the curtains down on Venom and Eddie's last dance.",6905.968,/aosm8NMQ3UyoBVpSxyimorCQykC.jpg,2024-10-22,Venom: The Last Dance,False,6.428,995
False,/tElnmtQ6yz1PjN1kePNl8yMSb59.jpg,"[16, 12, 10751, 35]",1241982,en,Moana 2,"After receiving an unexpected call from her wayfinding ancestors, Moana journeys alongside Maui and a new crew to the far seas of Oceania and into dangerous, long-lost waters for an adventure unlike anything she's ever faced.",5620.23,/yh64qw9mgXBvlaWDi7Q9tpUBAvH.jpg,2024-11-27,Moana 2,False,6.9,358
False,/au3o84ub27qTZiMiEc9UYzN74V3.jpg,"[28, 878, 53]",1035048,en,Elevation,A single father and two women venture from the safety of their homes to face monstrous creatures to save the life of a young boy.,2734.152,/uQhYBxOVFU6s9agD49FnGHwJqG5.jpg,2024-11-07,Elevation,False,6.3,108
False,/h3fwlwHotd3JfV13HdW0mxDcxPD.jpg,"[35, 10749, 10770]",957119,en,Sidelined: The QB and Me,"Dallas, a burdened but headstrong dancer, is determined to get into the best dance school in the country—her late mother’s alma mater. However, that dream is suddenly derailed when the cheeky yet secretly grieving football star, Drayton, crashes into her life with a unique story of his own. Will the two of them be able to grow into their dreams together, or will their dreams be sidelined?",1749.575,/f8H9sLin46B7ka4DEqjemGuiCOB.jpg,2024-11-29,Sidelined: The QB and Me,False,6.7,50
False,/nOoGIymGBNtA7AEN0B6nshSEQ1p.jpg,"[28, 80, 53]",974453,en,Absolution,"An aging ex-boxer gangster working as muscle for a Boston crime boss receives an upsetting diagnosis.  Despite a faltering memory, he attempts to rectify the sins of his past and reconnect with his estranged children. He is determined to leave a positive legacy for his grandson, but the criminal underworld isn’t done with him and won’t loosen their grip willingly.",1543.062,/cNtAslrDhk1i3IOZ16vF7df6lMy.jpg,2024-10-31,Absolution,False,6.1,113
False,/m2hs6YPVrzjvRC21SE9BeXtgqFW.jpg,"[16, 9648, 878, 28]",1299652,en,Watchmen: Chapter II,"Suspicious of the events ensnaring their former colleagues, Nite Owl and Silk Spectre are spurred out of retirement to investigate. As they grapple with personal ethics, inner demons and a society turned against them, they race the clock to uncover a deepening plot that might trigger global nuclear war.",1443.835,/4rBObJFpiWJOG7aIlRrOUniAkBs.jpg,2024-11-25,Watchmen: Chapter II,False,7.4,31
False,/evFChfYeD2LqobEJf8iQsrYcGTw.jpg,"[28, 80, 53]",1182387,en,Armor,"Armored truck security guard James Brody is working with his son Casey transporting millions of dollars between banks when a team of thieves led by Rook orchestrate a takeover of their truck to seize the riches. Following a violent car chase, Rook soon has the armored truck surrounded and James and Casey find themselves cornered onto a decrepit bridge.",1390.085,/pnXLFioDeftqjlCVlRmXvIdMsdP.jpg,2024-10-30,Armor,False,5.6,48
False,/euYIwmwkmz95mnXvufEmbL6ovhZ.jpg,"[28, 12, 36]",558449,en,Gladiator II,"Years after witnessing the death of the revered hero Maximus at the hands of his uncle, Lucius is forced to enter the Colosseum after his home is conquered by the tyrannical Emperors who now lead Rome with an iron fist. With rage in his heart and the future of the Empire at stake, Lucius must look to his past to find strength and honor to return the glory of Rome to its people.",1228.707,/2cxhvwyEwRlysAmRH4iodkvo0z5.jpg,2024-11-13,Gladiator II,False,6.65,952
False,/mQZJoIhTEkNhCYAqcHrQqhENLdu.jpg,"[16, 878, 10751]",1184918,en,The Wild Robot,"After a shipwreck, an intelligent robot called Roz is stranded on an uninhabited island. To survive the harsh environment, Roz bonds with the island's animals and cares for an orphaned baby goose.",1139.606,/wTnV3PCVW5O92JMrFvvrRcV39RU.jpg,2024-09-12,The Wild Robot,False,8.402,3320
False,/uVlUu174iiKhsUGqnOSy46eIIMU.jpg,"[18, 14, 10749]",402431,en,Wicked,"In the land of Oz, ostracized and misunderstood green-skinned Elphaba is forced to share a room with the popular aristocrat Glinda at Shiz University, and the two's unlikely friendship is tested as they begin to fulfill their respective destinies as Glinda the Good and the Wicked Witch of the West.",1059.738,/xDGbZ0JJ3mYaGKy4Nzd9Kph6M9L.jpg,2024-11-20,Wicked,False,7.6,424
False,/p5ozvmdgsmbWe0H8Xk7Rc8SCwAB.jpg,"[16, 12, 35, 18, 10751]",1022789,en,Inside Out 2,"Teenager Riley's mind headquarters is undergoing a sudden demolition to make room for something entirely unexpected: new Emotions! Joy, Sadness, Anger, Fear and Disgust, who’ve long been running a successful operation by all accounts, aren’t sure how to feel when Anxiety shows up. And it looks like she’s not alone.",1017.497,/vpnVM9B6NMmQpWeZvzLvDESb2QY.jpg,2024-06-11,Inside Out 2,False,7.576,4916
False,/2ndyL4HjM9JLMqBSgbyCM57aMWl.jpg,"[27, 53]",1034541,en,Terrifier 3,"Five years after surviving Art the Clown's Halloween massacre, Sienna and Jonathan are still struggling to rebuild their shattered lives. As the holiday season approaches, they try to embrace the Christmas spirit and leave the horrors of the past behind. But just when they think they're safe, Art returns, determined to turn their holiday cheer into a new nightmare. The festive season quickly unravels as Art unleashes his twisted brand of terror, proving that no holiday is safe.",944.757,/ju10W5gl3PPK3b7TjEmVOZap51I.jpg,2024-10-09,Terrifier 3,False,6.9,1189
False,/iR79ciqhtaZ9BE7YFA1HpCHQgX4.jpg,"[27, 9648]",1100782,en,Smile 2,"About to embark on a new world tour, global pop sensation Skye Riley begins experiencing increasingly terrifying and inexplicable events. Overwhelmed by the escalating horrors and the pressures of fame, Skye is forced to face her dark past to regain control of her life before it spirals out of control.",926.587,/ht8Uv9QPv9y7K0RvUyJIaXOZTfd.jpg,2024-10-16,Smile 2,False,6.577,854
False,/dvBCdCohwWbsP5qAaglOXagDMtk.jpg,"[28, 35, 878]",533535,en,Deadpool & Wolverine,"A listless Wade Wilson toils away in civilian life with his days as the morally flexible mercenary, Deadpool, behind him. But when his homeworld faces an existential threat, Wade must reluctantly suit-up again with an even more reluctant Wolverine.",850.496,/8cdWjvZQUExUUTzyp4t6EDMubfO.jpg,2024-07-24,Deadpool & Wolverine,False,7.677,5798
False,/2fxnTXr8NwyTFkunkimJkGkhqfy.jpg,"[18, 28, 27]",1118031,es,Apocalipsis Z: el principio del fin,"When a kind of rabies that transforms people into aggressive creatures spreads across the planet, Manel isolates himself at home with his cat, relying on his wits to survive; but soon they must go out in search of food, by land and by sea, dodging many dangers.",812.986,/wIGJnIFQlESkC2rLpfA8EDHqk4g.jpg,2024-10-04,Apocalypse Z: The Beginning of the End,False,6.8,660
False,/rOmUuQEZfPXglwFs5ELLLUDKodL.jpg,"[28, 35, 14]",845781,en,Red One,"After Santa Claus (codename: Red One) is kidnapped, the North Pole's Head of Security must team up with the world's most infamous bounty hunter in a globe-trotting, action-packed mission to save Christmas.",789.208,/cdqLnri3NEGcmfnqwk2TSIYtddg.jpg,2024-10-31,Red One,False,6.6,217
False,/7h6TqPB3ESmjuVbxCxAeB1c9OB1.jpg,"[27, 878, 53]",933260,en,The Substance,"A fading celebrity decides to use a black market drug, a cell-replicating substance that temporarily creates a younger, better version of herself.",787.886,/lqoMzCcZYEFK729d6qzt349fB4o.jpg,2024-09-07,The Substance,False,7.3,2413
False,/iJaSpQNZ8GsqVDWfbCXmyZQXZ5l.jpg,"[27, 878]",945961,en,Alien: Romulus,"While scavenging the deep ends of a derelict space station, a group of young space colonizers come face to face with the most terrifying life form in the universe.",774.994,/b33nnKl1GSFbao4l3fZDDqsMx0F.jpg,2024-08-13,Alien: Romulus,False,7.2,2558
False,/liuBLPXvisMRo5w2JEKHXceWq5u.jpg,"[28, 80, 18]",1171640,fr,GTMAX,"When a notorious gang of bikers recruits her brother for a heist, a former motocross champion must face her deepest fears to keep her family safe.",716.388,/bx92hl70NUhojjO3eV6LqKllj4L.jpg,2024-11-19,GTMAX,False,6.008,66
False,/cBTwQKMd7Vn6rGTGBtoFLIfj7uM.jpg,"[16, 12, 28, 14]",1147416,fr,"Miraculous World : Londres, la course contre le temps","To save the future from a terrible fate, Marinette becomes Chronobug and teams up with Bunnyx to defeat a mysterious opponent who travels through time. Who is this new supervillain, and why are they obsessed with exposing Marinette's secret superhero identity? Marinette's only hope is to defeat her new opponent to prevent the end of Ladybug and time itself!",658.113,/6AtoMpHvs9pxd30KsyK8QmJ9W9M.jpg,2024-11-14,"Miraculous World, London: At the Edge of Time",False,8.5,20
False,,"[10749, 18]",1252309,es,Pídeme lo que quieras,"After his father's death, Eric Zimmerman travels to Spain to oversee his company's branches. In Madrid, he falls for Judith and engage in an intense, erotic relationship full of exploration. However, Eric fears his secret may end their affair.",643.308,/76qnVxU2rPdVvipBN3DPQH6fVYB.jpg,2024-11-29,Pídeme lo que quieras,False,8.4,4
False,/kwXycPsLA6SV3KUOagn343TtMOf.jpg,"[28, 878, 53]",791042,en,Levels,"After witnessing his girlfriend's murder, a man risks everything - including reality itself - to discover the truth.",632.777,/y1xm0jMIlx9Oo2a3jWNyLGm43sJ.jpg,2024-11-01,Levels,False,5.689,37
False,/lgkPzcOSnTvjeMnuFzozRO5HHw1.jpg,"[16, 10751, 35, 28]",519182,en,Despicable Me 4,"Gru and Lucy and their girls—Margo, Edith and Agnes—welcome a new member to the Gru family, Gru Jr., who is intent on tormenting his dad. Gru also faces a new nemesis in Maxime Le Mal and his femme fatale girlfriend Valentina, forcing the family to go on the run.",626.709,/wWba3TaojhK7NdycRhoQpsG0FaH.jpg,2024-06-20,Despicable Me 4,False,7.08,2265
False,/uMXVeVL2v57lMv6pqBmegDHHPqz.jpg,"[16, 878, 12, 10751]",698687,en,Transformers One,"The untold origin story of Optimus Prime and Megatron, better known as sworn enemies, but once were friends bonded like brothers who changed the fate of Cybertron forever.",619.551,/qbkAqmmEIZfrCO8ZQAuIuVMlWoV.jpg,2024-09-11,Transformers One,False,8.105,832
False,/n4ycOGj2tRLfINTJQ3wl0vNYqpR.jpg,"[16, 14, 10751, 12, 35]",592983,en,Spellbound,"When a powerful spell turns her parents into giant monsters, a teenage princess must journey into the wild to reverse the curse before it's too late.",595.161,/xFSIygDiX70Esp9dheCgGX0Nj77.jpg,2024-11-22,Spellbound,False,6.8,128
False,/r4Xn4eWOyxye8m3dR80I8TPhfE5.jpg,"[28, 80, 18]",1326059,es,Pimpinero: Sangre y gasolina,"When Juan, a young gasoline smuggler, is forced to work for a mysterious organization in the desert bordering Colombia and Venezuela, his girlfriend Diana embarks on a journey to uncover the secrets that inhabit this no-man’s-land.",575.371,/kukotsflOSVGXQezuXohj41dbfL.jpg,2024-10-10,Pimpinero: Blood and Oil,False,7.1,27
False,/5O0mkQGfOQM4OktFOCep9YmXK79.jpg,"[28, 878, 53, 35, 27]",995803,en,Arena Wars,"In 2045 convicted criminals are given the opportunity to compete on the world's #1 televised sporting event, Arena Wars. They must survive 7 rooms and 7 of the most vicious killers in the country. If they win, they regain their freedom.",569.065,/4dRtXjk1rcsZlaMJpBn6Nh9cTfO.jpg,2024-06-25,Arena Wars,False,5.417,30
False,/uLqNGzJwnj8JKkKuRM2dHWJKCtc.jpg,"[28, 27, 53]",1029235,en,Azrael,"In a world where no one speaks, a devout female hunts down a young woman who has escaped her imprisonment. Recaptured by its ruthless leaders, Azrael is due to be sacrificed to pacify an ancient evil deep within the surrounding wilderness.",551.969,/qpdFKDvJS7oLKTcBLXOaMwUESbs.jpg,2024-09-27,Azrael,False,6.1,140
False,,"[12, 35, 10751, 14]",1108427,en,Moana,"In Ancient Polynesia, when a terrible curse incurred by Maui reaches the island of an impetuous Chieftain, his willful daughter answers the Ocean's call to seek out the demigod to set things right.  Live-action adaptation of the 2016 Disney animated film 'Moana'",518.488,/ys0jZr0quHERDUEoCboGQEKPvgQ.jpg,2026-07-09,Moana,False,0.0,0
False,/1FBHAQnq7Bs3djBmaNkfdVbnCUE.jpg,"[28, 53]",1124641,en,Classified,"Operating alone in the field for more than 20 years, a CIA hitman uses the ""Help Wanted"" section of the newspapers to get his orders from the Agency. His long-lost daughter, now a UK MI6 analyst, tracks him down to deliver shocking news: his CIA boss has been dead for years and the division long since shut down. Together, they set out to discover whose orders he's been executing.",477.583,/3k8jv1kSAAc0rCfFGtWDDQL4dfK.jpg,2024-09-19,Classified,False,5.9,91
False,/5PuM2lWFRVLZbyzErGVd8qHi55p.jpg,"[27, 53, 28]",1165466,en,Wake Up,"A group of young activists set out to make an environmental statement by vandalizing a home superstore as it closes. But their plan goes terribly wrong when they become trapped inside and must face a deranged security guard with a gruesome passion for primitive hunting. As the night fills with violence and terror, the teenagers find themselves in a desperate fight for their lives.",476.01,/erEAU7ygq2XFjziI3FpAdMajJFZ.jpg,2024-05-08,Wake Up,False,7.3,65
False,/lntyt4OVDbcxA1l7LtwITbrD3FI.jpg,"[10749, 18]",1010581,es,Culpa mía,"Noah must leave her city, boyfriend, and friends to move into William Leister's mansion, the flashy and wealthy husband of her mother Rafaela. As a proud and independent 17 year old, Noah resists living in a mansion surrounded by luxury. However, it is there where she meets Nick, her new stepbrother, and the clash of their strong personalities becomes evident from the very beginning.",466.245,/w46Vw536HwNnEzOa7J24YH9DPRS.jpg,2023-06-08,My Fault,False,7.915,3091
False,/5NGeHV2z8EByT3P23D471nSPjGS.jpg,"[53, 27, 80, 9648]",1084863,fr,Le Mangeur d'âmes,"When the disappearance of children and bloody murders multiply in a small mountain village, an old legend shrouded in sulphur reappears... Commander Guardiano and Captain of the Gendarmerie De Rolan are forced to join forces to uncover the truth.",463.265,/8XsQVmGQukwIVDM88Aa0C7L5hCp.jpg,2024-04-24,The Soul Eater,False,6.294,80
False,/djo5TTvyWK2b28QLi0FfMXu5nU3.jpg,"[35, 14, 27]",1097870,en,Dear Santa,"Likeable 6th grader Liam writes to Santa asking him to prove that he's real. But Liam is dyslexic and accidentally sends his letter to Satan instead, who shows up at Liam's house, excited to have his first fanboy letter and wanting a little of Liam's soul.",448.936,/fRbDHbGBXg6kwQYr3CRYeKPJW5q.jpg,2024-11-24,Dear Santa,False,6.6,88
False,/n9Do4rv1Hl3QvQLMmT5w6pBadqq.jpg,"[28, 10749, 18]",1142518,fr,Libre,"Inspired by the true events of one of France's most notorious non-violent robbers, Bruno Sulak, in the 1980s. He led multiple heists, then captured public attention for his many daring escapes from police custody...always to reunite with his beloved lover and accomplice Annie, becoming both France's Public Enemy #1 and an icon of Freedom.",426.713,/b2YL2kncIqlcDcqly78AsOPJi6r.jpg,2024-11-01,Freedom,False,6.6,72
False,/27FRFe8lu1C1LStWmzwOa87vo98.jpg,"[18, 9648, 27]",173705,ja,女教師 生徒の眼の前で,"The lovely Reiko has taken a new teaching job at a creepy old high school.  She is an extremely attractive woman and the young students in her class have fallen for her.  One night, after tennis practice, she is brutally assaulted in the locker room shower by a man with a stocking over his face.  Left on the floor naked and in shock, she discovers a single puzzle piece left behind by the crazed man.  A few days later, a pair of students enact a perverted sexual revenge on Reiko for kicking someone off the tennis team.  Could one of these students be the man who brutalized her in the locker room?  Who owns the strange puzzle piece?  As the mystery unfolds, Reiko must come to terms with her own sexual urges and fate.",417.562,/ilMXOocCCwPWCcDLLa6M0ga8vWt.jpg,1982-04-09,Female Teacher: In Front of the Students,False,6.6,17
False,/9s9o9RT9Yj6nDuRJjnJm78WFoFl.jpg,"[28, 27, 53, 878]",1051896,en,Arcadian,"In the near future, on a decimated Earth, Paul and his twin sons face terror at night when ferocious creatures awaken. When Paul is nearly killed, the boys come up with a plan for survival, using everything their father taught them to keep him alive.",401.136,/spWV1eRzlDxvai8LbxwAWR0Vst4.jpg,2024-04-12,Arcadian,False,6.105,474
False,/sv3clpwOSSZO1c8i9uX4zig6Lzz.jpg,"[53, 80, 9648, 28]",1252470,hi,सिकंदर का मुकद्दर,"After an unsolved diamond heist, a hard-nosed cop’s pursuit of his key suspect turns into obsession, until they finally face each other — and the truth.",399.087,/eWUh4rgxtgypgnOa6uGMnUt01ux.jpg,2024-11-29,Sikandar Ka Muqaddar,False,5.3,6
False,/kyVcNF6GRthdiT4oZn5XgJtl0F7.jpg,"[28, 80]",1233327,te,మట్కా,"Set between the years 1958 and 1982, Matka tells the story of Vasu, who rises from poverty to create a powerful gambling empire in India, ultimately leading the nation into a battle with the government. Based on real events, the tale explores themes of love, moral choices, and the consequences of ambition.",388.39,/jrHIKDq9xvKJhYBDvYwmAfs8qvr.jpg,2024-11-14,Matka,False,5.8,8
False,/4t8IXJF4umwCfbdpeKLvlN3zkKp.jpg,"[10749, 18]",1100099,en,We Live in Time,"An up-and-coming chef and a recent divorcée find their lives forever changed when a chance encounter brings them together, in a decade-spanning, deeply moving romance.",386.795,/oeDNBgnlGF6rnyX1P1K8Vl2f3lW.jpg,2024-10-10,We Live in Time,False,7.6,175
False,/csQSGH0QU8D3Ov5YLEYuHep8ihA.jpg,"[53, 12, 28, 878]",1196470,fr,Survivre,A couple celebrates their son’s birthday in the middle of the ocean on their boat. A violent storm hits and it brings up hungry creatures from the depths and they fight for their survival.,382.8,/7fR3KxswtY8OHHZuOUB9td58CRX.jpg,2024-06-19,Survive,False,5.9,72
False,/llIXQAndg5kB6SWlp6ouUdO7Zxd.jpg,"[28, 12, 18, 36, 10749, 53]",1084736,fr,Le Comte de Monte-Cristo,"Edmond Dantes becomes the target of a sinister plot and is arrested on his wedding day for a crime he did not commit. After 14 years in the island prison of Château d’If, he manages a daring escape. Now rich beyond his dreams, he assumes the identity of the Count of Monte-Cristo and exacts his revenge on the three men who betrayed him.",372.66,/7O0WDGsa4lBzqv3uaB1tp8UvFK3.jpg,2024-06-28,The Count of Monte-Cristo,False,8.2,940
False,/vIgyYkXkg6NC2whRbYjBD7eb3Er.jpg,"[878, 28, 12]",580489,en,Venom: Let There Be Carnage,"After finding a host body in investigative reporter Eddie Brock, the alien symbiote must face a new enemy, Carnage, the alter ego of serial killer Cletus Kasady.",372.624,/1MJNcPZy46hIy2CmSqOeru0yr5C.jpg,2021-09-30,Venom: Let There Be Carnage,False,6.8,10253
False,/VuukZLgaCrho2Ar8Scl9HtV3yD.jpg,"[878, 28]",335983,en,Venom,"Investigative journalist Eddie Brock attempts a comeback following a scandal, but accidentally becomes the host of Venom, a violent, super powerful alien symbiote. Soon, he must rely on his newfound powers to protect the world from a shadowy organization looking for a symbiote of their own.",371.794,/2uNW4WbgBXL25BAbXGLnLqX71Sw.jpg,2018-09-28,Venom,False,6.8,16051
False,/v9Du2HC3hlknAvGlWhquRbeifwW.jpg,"[28, 12, 53]",539972,en,Kraven the Hunter,"Kraven Kravinoff's complex relationship with his ruthless gangster father, Nikolai, starts him down a path of vengeance with brutal consequences, motivating him to become not only the greatest hunter in the world, but also one of its most feared.",370.288,/1GvBhRxY6MELDfxFrete6BNhBB5.jpg,2024-12-11,Kraven the Hunter,False,0.0,0
False,/wHytVsfAZsVDAcABd6iQGmE2j29.jpg,"[53, 28, 80]",156022,en,The Equalizer,"McCall believes he has put his mysterious past behind him and dedicated himself to beginning a new, quiet life. But when he meets Teri, a young girl under the control of ultra-violent Russian gangsters, he can’t stand idly by – he has to help her. Armed with hidden skills that allow him to serve vengeance against anyone who would brutalize the helpless, McCall comes out of his self-imposed retirement and finds his desire for justice reawakened. If someone has a problem, if the odds are stacked against them, if they have nowhere else to turn, McCall will help. He is The Equalizer.",367.888,/9u4yW7yPA0BQ2pv9XwiNzItwvp8.jpg,2014-09-24,The Equalizer,False,7.28,9017
False,/pjHpobTyiHPO5OTbfi9DHyynKHp.jpg,"[14, 10751, 12, 18]",1365044,no,Snøsøsteren,"A young boy whose grieving family has forgotten about Christmas forms an unexpected, healing bond with a bubbly girl full of holiday spirit.",363.41,/2fTfJ6r53crzkTTSQurGoX1baSD.jpg,2024-11-28,The Snow Sister,False,6.6,15
False,/wB8HiUiFWo1EsxrdvB6bsMNW81g.jpg,"[28, 80, 53]",1151949,id,The Shadow Strays,"Skilled in the art of killing, a young assassin defies her mentor to save a boy from a ruthless crime syndicate — and she'll destroy anyone in her path.",358.926,/cfkcrKySRyJiIdLo6c6kNSyLFh7.jpg,2024-09-10,The Shadow Strays,False,7.4,156
False,/c6nouvFYnmNO50WQDLcKMI3p0jA.jpg,"[12, 10751, 18]",762509,en,Mufasa: The Lion King,"Rafiki relays the legend of Mufasa to lion cub Kiara, daughter of Simba and Nala, with Timon and Pumbaa lending their signature schtick. Told in flashbacks, the story introduces Mufasa as an orphaned cub, lost and alone until he meets a sympathetic lion named Taka—the heir to a royal bloodline. The chance meeting sets in motion a journey of misfits searching for their destiny and working together to evade a threatening and deadly foe.",353.897,/lurEK87kukWNaHd0zYnsi3yzJrs.jpg,2024-12-18,Mufasa: The Lion King,False,0.0,0
False,/tncbMvfV0V07UZozXdBEq4Wu9HH.jpg,"[28, 35]",573435,en,Bad Boys: Ride or Die,"After their late former Captain is framed, Lowrey and Burnett try to clear his name, only to end up on the run themselves.",351.07,/oGythE98MYleE6mZlGs5oBGkux1.jpg,2024-06-05,Bad Boys: Ride or Die,False,7.5,2412
False,/hkJhGayONXn96CqIRM9GhWKnlCf.jpg,"[28, 12, 16, 14]",1014505,ja,劇場版「オーバーロード」聖王国編,"After twelve years of playing his favorite MMORPG game, Momonga logs in for the last time only to find himself transported into its world playing it indefinitely. Throughout his adventures, his avatar ascends to the title of Sorcerer King Ains Ooal Gown. Once prosperous but now on the brink of ruin, The Sacred Kingdom enjoyed years of peace after construction of an enormous wall protecting them from neighboring invasions. But, one day this comes to an end when the Demon Emperor Jaldabaoth arrives with an army of villainous demi-humans. Fearing invasion of their own lands, the neighboring territory of the Slane Theocracy is forced to beg their enemies at the Sorcerer Kingdom for help. Heeding the call, Momonga, now known as the Sorcerer King Ains Ooal Gown, rallies the Sorcerer Kingdom and its undead army to join the fight alongside the Sacred Kingdom and the Slane Theocracy in hopes to defeat the Demon Emperor.",349.287,/jEvytxNa5mfW7VAUmDWsZtIdATc.jpg,2024-09-20,OVERLORD: The Sacred Kingdom,False,7.9,21
False,/vSBnSdEllJPMBniDh1eSqNHS5Mk.jpg,"[28, 53]",1331375,en,Dominique,"Dominique, a well-trained assassin, flees from her troubled past in an attempt to begin a new life in South America. However, she soon finds herself in a town plagued with violence and corruption. Facing brutal attacks from the police and mafia, Dominique must decide whether to protect herself or an innocent family that has taken her in.",346.948,/jvug7Esd89yNLJwGvUfeQ9j69cE.jpg,2024-10-11,Dominique,False,7.5,65
False,,"[10749, 18]",482600,ko,일본 엄마,"""Innocent face, D-cup breasts and perfect intercourse skills! Son, this is not your girlfriend anymore but your mother!""  Ki-ho brings Yuki from Japan to marry her. However, he starts cheating on her with his ex-girlfriend in Korea.  Min-cheol comforted Yuki and thought of her as his daughter-in-law, but one day he realizes he is looking at her as a woman.  In the end, Yuki and Min-cheol have intercourse without Ki-ho knowing...",340.159,/hq1EaYIqUNrPM3QFYAbnH2UHoX8.jpg,2017-02-09,Japanese Mom,False,6.179,28
False,/xJHokMbljvjADYdit5fK5VQsXEG.jpg,"[12, 18, 878]",157336,en,Interstellar,The adventures of a group of explorers who make use of a newly discovered wormhole to surpass the limitations on human space travel and conquer the vast distances involved in an interstellar voyage.,339.938,/gEU2QniE6E77NI6lCU6MxlNBvIx.jpg,2014-11-05,Interstellar,False,8.443,35731
False,/5tqkP8NNWdteskVBYPRXE6h82ts.jpg,[18],592695,sv,Pleasure,"19 year old Linnéa leaves her small town in Sweden and heads for Los Angeles with the aim of becoming the world's next big porn star, but the road to her goal turns out to be bumpier than she imagined.",333.864,/7Z2K08J0WantJHNa0vLTOmii41l.jpg,2021-10-08,Pleasure,False,6.226,554
False,/2NPhBHfzhEmXl8csQ2dKmoxfj5e.jpg,"[80, 53, 28]",972614,en,Knox Goes Away,"A contract killer, after being diagnosed with a fast-moving form of dementia, is presented with the opportunity to redeem himself by saving the life of his estranged adult son. But to do so, he must race against the police closing in on him as well as the ticking clock of his own rapidly deteriorating mind.",331.931,/w39qKYjltCix18BwtoZ1e45usdb.jpg,2024-03-15,Knox Goes Away,False,6.879,269
False,/9Qq8InnodUYs8zdam8Zj967i6RO.jpg,"[80, 18]",1106739,en,Juror #2,"While serving as a juror in a high profile murder trial, family man Justin Kemp finds himself struggling with a serious moral dilemma…one he could use to sway the jury verdict and potentially convict—or free—the accused killer.",328.794,/ugQkpGajKFQ8eyOEhGheR0HfWQ.jpg,2024-10-30,Juror #2,False,7.0,509
